{
  "approvalId": "recognition-common-2026-07-26-01-mathieu-fortin-data-paramedic",
  "approvedAt": "2026-07-26T06:20:28.961Z",
  "approvers": {
    "data": "Mathieu Fortin — RxScan Technologies",
    "paramedic": "Mathieu Fortin — RxScan Technologies"
  },
  "manifestSha256": "9a928596b01eee5a29ecf6887cc33a8d1d1d1b1bf4db4186db555784b5c12f47",
  "profileSha256": "e07e7d0517176230a13d87404d939aaade0a4d89c49298c2c448e9fef19f2c63",
  "releaseId": "recognition-common-2026-07-26-01",
  "schemaVersion": "1.0.0",
  "sourceCommit": "b8b81b2e2bb8f6890cfc0fb54b15c311f3761633"
}
